id,titulo,autor,fecha_submission,url,sentiment,Positivo,Negativo,Neutro
1c4nxvo,Justice Thomas misses Supreme Court session Monday with no explanation,reptilefood,2024-04-15 14:42:23,https://thehill.com/homenews/ap/ap-politics/ap-justice-thomas-misses-supreme-court-session-monday-with-no-explanation/,-1,0,1,0
1c4j0bv,We May Finally Get To Write: “Convicted Felon Donald Trump”,Quirkie,2024-04-15 10:39:20,https://newrepublic.com/article/180694/trump-hush-money-jury-trial,1,1,0,0
1c4miei,Trump rages at judge hours before hush money case begins,thehill,2024-04-15 13:41:28,https://thehill.com/regulation/court-battles/4594517-trump-posts-hush-money-trial-judge/,1,1,0,0
1c4q7dw,Prosecutors Want Trump Held in Contempt of Court for Violating Gag Order,rollingstone,2024-04-15 16:15:13,https://www.rollingstone.com/politics/politics-news/trump-new-york-hush-money-trial-day-one-1235004719/,-1,0,1,0
1c4pdxm,Clarence Thomas absent from US supreme court with no explanation,Afrin_Drip,2024-04-15 15:42:05,https://www.theguardian.com/us-news/2024/apr/15/clarence-thomas-absent-supreme-court,-1,0,1,0
1c4ne3g,Donald Trump to reveal bond details as Letitia James poised to strike,newsweek,2024-04-15 14:19:02,https://www.newsweek.com/donald-trump-letitia-james-bond-arthur-engoron-new-york-manhattan-fraud-trial-1890249,1,1,0,0
1c4oc57,Joe Biden now leads Donald Trump in ten polls,newsweek,2024-04-15 14:59:01,https://www.newsweek.com/joe-biden-donald-trump-polls-presidential-election-2024-latest-1889766,1,1,0,0
1c4hrwt,Donald Trump is falling behind Joe Biden in battleground state campaigning,BelleAriel,2024-04-15 09:17:06,https://www.newsweek.com/donald-trump-falling-behind-joe-biden-battleground-state-campaigning-1889429,1,1,0,0
1c4j8dk,Mark Kelly says Arizona abortion ruling is ‘all because of Donald Trump’,sandyWB,2024-04-15 10:53:28,https://thehill.com/homenews/senate/4593471-sen-kelly-says-arizona-abortion-ruling-is-all-because-of-donald-trump/,1,1,0,0
1c4qi4v,"""Every time I buy more, the price drops more"": Trump supporters grapple with Truth Social losses Many invested in Truth Social to support former President Donald Trump, but steep losses are testing their faith",Arrest_The_President,2024-04-15 16:27:15,https://www.salon.com/2024/04/15/every-time-i-buy-more-the-price-drops-more-supporters-grapple-with-truth-social-losses/?in_brief=true,-1,0,1,0
1c4ocdb,The Supreme Court effectively abolishes the right to mass protest in three US states,larel8,2024-04-15 14:59:17,https://www.vox.com/scotus/24080080/supreme-court-mckesson-doe-first-amendment-protest-black-lives-matter,-1,0,1,0
1c4kgkb,Donald Trump claims he'll testify in hush money trial. We've heard that before.,mountaintop111,2024-04-15 12:02:45,https://www.businessinsider.com/donald-trump-claims-he-will-testify-in-hush-money-trial-2024-4,0,0,0,1
1c4q0ec,‘Where’s Melania?’: She’s Not Standing by Her Man at Trial,thedailybeast,2024-04-15 16:07:18,https://www.thedailybeast.com/melania-trump-a-no-show-at-first-day-of-hush-money-trial,-1,0,1,0
1c4jb51,Kansas governor vetoes bill banning trans youth healthcare: ‘Not a Kansas value’,PinkNews,2024-04-15 10:58:19,https://www.thepinknews.com/2024/04/15/kansas-governor-trans-healthcare-ban/,-1,0,1,0
1c4m3qq,What Happens if Donald Trump Is Convicted?,Majano57,2024-04-15 13:22:58,https://www.nytimes.com/article/trump-investigation-conviction.html?unlocked_article_code=1.kk0.sIQa.Z_KYFVINZmTl,-1,0,1,0
1c4idpu,Donald Trump’s criminal trial over hush money to begin in New York,bakhesh,2024-04-15 09:58:38,https://www.theguardian.com/us-news/2024/apr/15/donald-trump-trial-hush-money-stormy-daniels,0,0,0,1
1c4oiuq,Donald Trump Seems Well Aware He’s in Legal Peril,bloombergopinion,2024-04-15 15:06:26,https://www.bloomberg.com/opinion/articles/2024-04-15/donald-trump-seems-aware-criminal-trial-puts-him-in-legal-peril?srnd=opinion,0,0,0,1
1c4ryl5,A Weary Trump Appears to Doze Off in Courtroom Ahead of Criminal Trial,Ok-Sweet-8495,2024-04-15 17:26:06,https://www.nytimes.com/2024/04/15/nyregion/trump-asleep-criminal-trial.html,-1,0,1,0
1c4k7xp,GOP Lawmakers Are All-In on Trump—a Conviction Be Damned,semaphone-1842,2024-04-15 11:50:10,https://www.thedailybeast.com/gop-lawmakers-are-all-in-on-trumpa-conviction-be-damned,0,0,0,1
1c4pxs3,‘That must stop’: Exasperated Jack Smith has had enough of Trump’s ‘open-ended’ Mar-a-Lago case delay requests based on start of New York hush-money trial,Sachyriel,2024-04-15 16:04:20,https://lawandcrime.com/high-profile/that-must-stop-exasperated-jack-smith-has-had-enough-of-trumps-open-ended-mar-a-lago-case-delay-requests-based-on-start-of-new-york-hush-money-trial/,-1,0,1,0
1c4jdj7,The People v Donald Trump: Inside the first-ever criminal trial of an American president,theindependentonline,2024-04-15 11:01:56,https://www.independent.co.uk/news/world/americas/us-politics/trump-hush-money-trial-corrupt-presidential-election-b2526450.html,-1,0,1,0
1c4melc,A Test of Strength: Biden stands with America’s allies. Trump doesn’t.,Majano57,2024-04-15 13:36:32,https://www.theatlantic.com/politics/archive/2024/04/what-israels-allies-must-do-now/678070/?gift=p6sIQZu1XYg3_VzQwH5cuDeSg4uzNm8OY0LeGsclqaY,1,1,0,0
1c4o95n,I Was a Skeptic of the Stormy Daniels Prosecution. I Was Wrong. The prosecution of Donald Trump starting in New York this week is on firm legal ground.,Ixz72,2024-04-15 14:55:33,https://slate.com/news-and-politics/2024/04/stormy-daniels-prosecution-stronger-than-i-thought.html,-1,0,1,0
1c4r389,Prosecutors ask hush money judge to fine Trump $3K for violating gag order,Equalizer6338,2024-04-15 16:51:06,https://thehill.com/regulation/court-battles/4595027-prosecutors-hush-money-judge-fine-trump-gag-order/,0,0,0,1
1c4qkf6,Swalwell accuses Clay Travis of jury tampering in Trump trial,newnemo,2024-04-15 16:29:53,https://thehill.com/homenews/media/4594964-trump-hush-money-trial-swalwell-clay-travis/,-1,0,1,0
1c4rz1g,Did Trump fall asleep during his hush money trial?,Kevombat,2024-04-15 17:26:37,https://www.nj.com/politics/2024/04/did-trump-fall-asleep-during-his-hush-money-trial.html,-1,0,1,0
1c4o31f,Trump to make history as first US president to face criminal trial,mountaintop111,2024-04-15 14:48:25,https://thehill.com/regulation/court-battles/4590650-trump-to-make-history-as-first-us-president-to-face-criminal-trial/,1,1,0,0
1c4bsqx,'Assault weapons' ban passes Colorado House,ParadeSit,2024-04-15 02:59:33,https://www.9news.com/mobile/article/news/local/local-politics/assault-weapons-ban-colorado-house/73-2463bf88-62fe-458f-829a-536f99a238df,-1,0,1,0
1c492js,Trump’s Out of Control Antics Simply Won’t Work in Court,croato87,2024-04-15 00:42:13,https://www.thedailybeast.com/trumps-out-of-control-antics-simply-wont-work-in-court,-1,0,1,0
1c4l0rz,Questions About Assassinations Test the Limits of Trump’s Immunity Claim,Car_o_lyn,2024-04-15 12:31:15,https://www.nytimes.com/2024/04/15/us/trump-supreme-court-immunity-assassinations.html,0,0,0,1
1c4qgnr,Donald Trump's polling numbers are dropping,major-PITA,2024-04-15 16:25:36,https://www.newsweek.com/donald-trump-polls-biden-2024-trial-1890367,1,1,0,0
1c4m6p0,'We Cannot Let the Warmongers Win': US Progressives Reject Calls for Attack on Iran,metacyan,2024-04-15 13:26:47,https://www.commondreams.org/news/us-progressives-war-iran,-1,0,1,0
1c49nzw,"Majority of voters think Trump committed ‘serious federal crimes,’ according to NYT poll",TurretLauncher,2024-04-15 01:11:10,https://www.politico.com/news/2024/04/13/trump-crimes-poll-voters-00152110,1,1,0,0
1c4rglv,"Justice Clarence Thomas misses hearings, no explanation given",LawNo9454,2024-04-15 17:05:53,https://www.upi.com/Top_News/US/2024/04/15/Clarence-Thomas/6051713199264/,-1,0,1,0
1c4kfmn,Trump's Criminal Trial to Begin Today In Manhattan With Jury Selection,CL-Young,2024-04-15 12:01:29,https://www.nytimes.com/2024/04/15/nyregion/trump-trial-hush-money.html,-1,0,1,0
1c4pq3i,"Unions are ‘gonna win in the South’ in 2024, United Auto Workers chief Shawn Fain says",ParadeSit,2024-04-15 15:55:40,https://www.al.com/news/2024/04/unions-are-gonna-win-in-the-south-in-2024-united-auto-workers-chief-shawn-fain-says.html,1,1,0,0
1c4phjt,"Trump's criminal trial, a first for a former president, has begun in New York",JJLewisLV,2024-04-15 15:46:06,https://www.npr.org/2024/04/15/1238536885/trump-hush-money-trial,1,1,0,0
1c4qfll,Robert F. Kennedy Jr. Says He Was Approached to Be Trump's VP,JJLewisLV,2024-04-15 16:24:25,https://www.newsweek.com/robert-kennedy-rfk-jr-claims-he-was-asked-donald-trump-vice-president-1890441,1,1,0,0
1c4r4x8,Trump hush money trial judge rejects new demand to recuse himself from case,Equalizer6338,2024-04-15 16:52:55,https://thehill.com/regulation/court-battles/4594721-trump-hush-money-trial-judge-rejects-new-demand-to-recuse-himself-from-case/,-1,0,1,0
1c4mu4i,Why the Higher Ed World Is Scared of a Second Trump Term,mcthrowawayman1,2024-04-15 13:56:05,https://time.com/6966465/donald-trump-universities-agenda-antisemitism/,-1,0,1,0
1c44ymm,"Republican governor admits his support for Trump ""doesn't make sense""",Oleg101,2024-04-14 21:35:25,https://www.newsweek.com/chris-sununu-admits-support-donald-trump-doesnt-make-sense-1890161,1,1,0,0
1c4kg2p,Trump trial set to kick off today in a historic first for a former president,CL-Young,2024-04-15 12:02:03,https://www.cbsnews.com/news/trump-trial-begins-today-jury-selection/,1,1,0,0
1c3vsyo,Trump Says He Has Enough Votes to “Cancel” 2024 Presidential Election,Johannastraat,2024-04-14 15:11:28,https://truthout.org/articles/trump-says-he-has-enough-votes-to-cancel-2024-presidential-election/,0,0,0,1
1c4nxvo,Justice Thomas misses Supreme Court session Monday with no explanation,reptilefood,2024-04-15 14:42:23,https://thehill.com/homenews/ap/ap-politics/ap-justice-thomas-misses-supreme-court-session-monday-with-no-explanation/,-1,0,1,0
1c4j0bv,We May Finally Get To Write: “Convicted Felon Donald Trump”,Quirkie,2024-04-15 10:39:20,https://newrepublic.com/article/180694/trump-hush-money-jury-trial,1,1,0,0
1c4q7dw,Prosecutors Want Trump Held in Contempt of Court for Violating Gag Order,rollingstone,2024-04-15 16:15:13,https://www.rollingstone.com/politics/politics-news/trump-new-york-hush-money-trial-day-one-1235004719/,-1,0,1,0
1c4pdxm,Clarence Thomas absent from US supreme court with no explanation,Afrin_Drip,2024-04-15 15:42:05,https://www.theguardian.com/us-news/2024/apr/15/clarence-thomas-absent-supreme-court,-1,0,1,0
1c4miei,Trump rages at judge hours before hush money case begins,thehill,2024-04-15 13:41:28,https://thehill.com/regulation/court-battles/4594517-trump-posts-hush-money-trial-judge/,1,1,0,0
1c4ne3g,Donald Trump to reveal bond details as Letitia James poised to strike,newsweek,2024-04-15 14:19:02,https://www.newsweek.com/donald-trump-letitia-james-bond-arthur-engoron-new-york-manhattan-fraud-trial-1890249,1,1,0,0
1c4oc57,Joe Biden now leads Donald Trump in ten polls,newsweek,2024-04-15 14:59:01,https://www.newsweek.com/joe-biden-donald-trump-polls-presidential-election-2024-latest-1889766,1,1,0,0
1c4ryl5,A Weary Trump Appears to Doze Off in Courtroom Ahead of Criminal Trial,Ok-Sweet-8495,2024-04-15 17:26:06,https://www.nytimes.com/2024/04/15/nyregion/trump-asleep-criminal-trial.html,-1,0,1,0
1c4qi4v,"""Every time I buy more, the price drops more"": Trump supporters grapple with Truth Social losses Many invested in Truth Social to support former President Donald Trump, but steep losses are testing their faith",Arrest_The_President,2024-04-15 16:27:15,https://www.salon.com/2024/04/15/every-time-i-buy-more-the-price-drops-more-supporters-grapple-with-truth-social-losses/?in_brief=true,-1,0,1,0
1c4hrwt,Donald Trump is falling behind Joe Biden in battleground state campaigning,BelleAriel,2024-04-15 09:17:06,https://www.newsweek.com/donald-trump-falling-behind-joe-biden-battleground-state-campaigning-1889429,1,1,0,0
