id,titulo,autor,fecha_submission,url
1c4nxvo,Justice Thomas misses Supreme Court session Monday with no explanation,reptilefood,1713192143.0,https://thehill.com/homenews/ap/ap-politics/ap-justice-thomas-misses-supreme-court-session-monday-with-no-explanation/
1c4j0bv,We May Finally Get To Write: “Convicted Felon Donald Trump”,Quirkie,1713177560.0,https://newrepublic.com/article/180694/trump-hush-money-jury-trial
1c4miei,Trump rages at judge hours before hush money case begins,thehill,1713188488.0,https://thehill.com/regulation/court-battles/4594517-trump-posts-hush-money-trial-judge/
1c4q7dw,Prosecutors Want Trump Held in Contempt of Court for Violating Gag Order,rollingstone,1713197713.0,https://www.rollingstone.com/politics/politics-news/trump-new-york-hush-money-trial-day-one-1235004719/
1c4pdxm,Clarence Thomas absent from US supreme court with no explanation,Afrin_Drip,1713195725.0,https://www.theguardian.com/us-news/2024/apr/15/clarence-thomas-absent-supreme-court
1c4ne3g,Donald Trump to reveal bond details as Letitia James poised to strike,newsweek,1713190742.0,https://www.newsweek.com/donald-trump-letitia-james-bond-arthur-engoron-new-york-manhattan-fraud-trial-1890249
1c4oc57,Joe Biden now leads Donald Trump in ten polls,newsweek,1713193141.0,https://www.newsweek.com/joe-biden-donald-trump-polls-presidential-election-2024-latest-1889766
1c4hrwt,Donald Trump is falling behind Joe Biden in battleground state campaigning,BelleAriel,1713172626.0,https://www.newsweek.com/donald-trump-falling-behind-joe-biden-battleground-state-campaigning-1889429
1c4j8dk,Mark Kelly says Arizona abortion ruling is ‘all because of Donald Trump’,sandyWB,1713178408.0,https://thehill.com/homenews/senate/4593471-sen-kelly-says-arizona-abortion-ruling-is-all-because-of-donald-trump/
1c4qi4v,"""Every time I buy more, the price drops more"": Trump supporters grapple with Truth Social losses Many invested in Truth Social to support former President Donald Trump, but steep losses are testing their faith",Arrest_The_President,1713198435.0,https://www.salon.com/2024/04/15/every-time-i-buy-more-the-price-drops-more-supporters-grapple-with-truth-social-losses/?in_brief=true
1c4ocdb,The Supreme Court effectively abolishes the right to mass protest in three US states,larel8,1713193157.0,https://www.vox.com/scotus/24080080/supreme-court-mckesson-doe-first-amendment-protest-black-lives-matter
1c4kgkb,Donald Trump claims he'll testify in hush money trial. We've heard that before.,mountaintop111,1713182565.0,https://www.businessinsider.com/donald-trump-claims-he-will-testify-in-hush-money-trial-2024-4
1c4q0ec,‘Where’s Melania?’: She’s Not Standing by Her Man at Trial,thedailybeast,1713197238.0,https://www.thedailybeast.com/melania-trump-a-no-show-at-first-day-of-hush-money-trial
1c4jb51,Kansas governor vetoes bill banning trans youth healthcare: ‘Not a Kansas value’,PinkNews,1713178699.0,https://www.thepinknews.com/2024/04/15/kansas-governor-trans-healthcare-ban/
1c4m3qq,What Happens if Donald Trump Is Convicted?,Majano57,1713187378.0,https://www.nytimes.com/article/trump-investigation-conviction.html?unlocked_article_code=1.kk0.sIQa.Z_KYFVINZmTl
1c4idpu,Donald Trump’s criminal trial over hush money to begin in New York,bakhesh,1713175118.0,https://www.theguardian.com/us-news/2024/apr/15/donald-trump-trial-hush-money-stormy-daniels
1c4oiuq,Donald Trump Seems Well Aware He’s in Legal Peril,bloombergopinion,1713193586.0,https://www.bloomberg.com/opinion/articles/2024-04-15/donald-trump-seems-aware-criminal-trial-puts-him-in-legal-peril?srnd=opinion
1c4ryl5,A Weary Trump Appears to Doze Off in Courtroom Ahead of Criminal Trial,Ok-Sweet-8495,1713201966.0,https://www.nytimes.com/2024/04/15/nyregion/trump-asleep-criminal-trial.html
1c4k7xp,GOP Lawmakers Are All-In on Trump—a Conviction Be Damned,semaphone-1842,1713181810.0,https://www.thedailybeast.com/gop-lawmakers-are-all-in-on-trumpa-conviction-be-damned
1c4pxs3,‘That must stop’: Exasperated Jack Smith has had enough of Trump’s ‘open-ended’ Mar-a-Lago case delay requests based on start of New York hush-money trial,Sachyriel,1713197060.0,https://lawandcrime.com/high-profile/that-must-stop-exasperated-jack-smith-has-had-enough-of-trumps-open-ended-mar-a-lago-case-delay-requests-based-on-start-of-new-york-hush-money-trial/
1c4jdj7,The People v Donald Trump: Inside the first-ever criminal trial of an American president,theindependentonline,1713178916.0,https://www.independent.co.uk/news/world/americas/us-politics/trump-hush-money-trial-corrupt-presidential-election-b2526450.html
1c4melc,A Test of Strength: Biden stands with America’s allies. Trump doesn’t.,Majano57,1713188192.0,https://www.theatlantic.com/politics/archive/2024/04/what-israels-allies-must-do-now/678070/?gift=p6sIQZu1XYg3_VzQwH5cuDeSg4uzNm8OY0LeGsclqaY
1c4o95n,I Was a Skeptic of the Stormy Daniels Prosecution. I Was Wrong. The prosecution of Donald Trump starting in New York this week is on firm legal ground.,Ixz72,1713192933.0,https://slate.com/news-and-politics/2024/04/stormy-daniels-prosecution-stronger-than-i-thought.html
1c4r389,Prosecutors ask hush money judge to fine Trump $3K for violating gag order,Equalizer6338,1713199866.0,https://thehill.com/regulation/court-battles/4595027-prosecutors-hush-money-judge-fine-trump-gag-order/
1c4qkf6,Swalwell accuses Clay Travis of jury tampering in Trump trial,newnemo,1713198593.0,https://thehill.com/homenews/media/4594964-trump-hush-money-trial-swalwell-clay-travis/
1c4rz1g,Did Trump fall asleep during his hush money trial?,Kevombat,1713201997.0,https://www.nj.com/politics/2024/04/did-trump-fall-asleep-during-his-hush-money-trial.html
1c4o31f,Trump to make history as first US president to face criminal trial,mountaintop111,1713192505.0,https://thehill.com/regulation/court-battles/4590650-trump-to-make-history-as-first-us-president-to-face-criminal-trial/
1c4bsqx,'Assault weapons' ban passes Colorado House,ParadeSit,1713149973.0,https://www.9news.com/mobile/article/news/local/local-politics/assault-weapons-ban-colorado-house/73-2463bf88-62fe-458f-829a-536f99a238df
1c492js,Trump’s Out of Control Antics Simply Won’t Work in Court,croato87,1713141733.0,https://www.thedailybeast.com/trumps-out-of-control-antics-simply-wont-work-in-court
1c4l0rz,Questions About Assassinations Test the Limits of Trump’s Immunity Claim,Car_o_lyn,1713184275.0,https://www.nytimes.com/2024/04/15/us/trump-supreme-court-immunity-assassinations.html
1c4qgnr,Donald Trump's polling numbers are dropping,major-PITA,1713198336.0,https://www.newsweek.com/donald-trump-polls-biden-2024-trial-1890367
1c4m6p0,'We Cannot Let the Warmongers Win': US Progressives Reject Calls for Attack on Iran,metacyan,1713187607.0,https://www.commondreams.org/news/us-progressives-war-iran
1c49nzw,"Majority of voters think Trump committed ‘serious federal crimes,’ according to NYT poll",TurretLauncher,1713143470.0,https://www.politico.com/news/2024/04/13/trump-crimes-poll-voters-00152110
1c4rglv,"Justice Clarence Thomas misses hearings, no explanation given",LawNo9454,1713200753.0,https://www.upi.com/Top_News/US/2024/04/15/Clarence-Thomas/6051713199264/
1c4kfmn,Trump's Criminal Trial to Begin Today In Manhattan With Jury Selection,CL-Young,1713182489.0,https://www.nytimes.com/2024/04/15/nyregion/trump-trial-hush-money.html
1c4pq3i,"Unions are ‘gonna win in the South’ in 2024, United Auto Workers chief Shawn Fain says",ParadeSit,1713196540.0,https://www.al.com/news/2024/04/unions-are-gonna-win-in-the-south-in-2024-united-auto-workers-chief-shawn-fain-says.html
1c4phjt,"Trump's criminal trial, a first for a former president, has begun in New York",JJLewisLV,1713195966.0,https://www.npr.org/2024/04/15/1238536885/trump-hush-money-trial
1c4qfll,Robert F. Kennedy Jr. Says He Was Approached to Be Trump's VP,JJLewisLV,1713198265.0,https://www.newsweek.com/robert-kennedy-rfk-jr-claims-he-was-asked-donald-trump-vice-president-1890441
1c4r4x8,Trump hush money trial judge rejects new demand to recuse himself from case,Equalizer6338,1713199975.0,https://thehill.com/regulation/court-battles/4594721-trump-hush-money-trial-judge-rejects-new-demand-to-recuse-himself-from-case/
1c4mu4i,Why the Higher Ed World Is Scared of a Second Trump Term,mcthrowawayman1,1713189365.0,https://time.com/6966465/donald-trump-universities-agenda-antisemitism/
1c44ymm,"Republican governor admits his support for Trump ""doesn't make sense""",Oleg101,1713130525.0,https://www.newsweek.com/chris-sununu-admits-support-donald-trump-doesnt-make-sense-1890161
1c4kg2p,Trump trial set to kick off today in a historic first for a former president,CL-Young,1713182523.0,https://www.cbsnews.com/news/trump-trial-begins-today-jury-selection/
1c3vsyo,Trump Says He Has Enough Votes to “Cancel” 2024 Presidential Election,Johannastraat,1713107488.0,https://truthout.org/articles/trump-says-he-has-enough-votes-to-cancel-2024-presidential-election/
1c4nxvo,Justice Thomas misses Supreme Court session Monday with no explanation,reptilefood,1713192143.0,https://thehill.com/homenews/ap/ap-politics/ap-justice-thomas-misses-supreme-court-session-monday-with-no-explanation/
1c4j0bv,We May Finally Get To Write: “Convicted Felon Donald Trump”,Quirkie,1713177560.0,https://newrepublic.com/article/180694/trump-hush-money-jury-trial
1c4q7dw,Prosecutors Want Trump Held in Contempt of Court for Violating Gag Order,rollingstone,1713197713.0,https://www.rollingstone.com/politics/politics-news/trump-new-york-hush-money-trial-day-one-1235004719/
1c4pdxm,Clarence Thomas absent from US supreme court with no explanation,Afrin_Drip,1713195725.0,https://www.theguardian.com/us-news/2024/apr/15/clarence-thomas-absent-supreme-court
1c4miei,Trump rages at judge hours before hush money case begins,thehill,1713188488.0,https://thehill.com/regulation/court-battles/4594517-trump-posts-hush-money-trial-judge/
1c4ne3g,Donald Trump to reveal bond details as Letitia James poised to strike,newsweek,1713190742.0,https://www.newsweek.com/donald-trump-letitia-james-bond-arthur-engoron-new-york-manhattan-fraud-trial-1890249
1c4oc57,Joe Biden now leads Donald Trump in ten polls,newsweek,1713193141.0,https://www.newsweek.com/joe-biden-donald-trump-polls-presidential-election-2024-latest-1889766
1c4ryl5,A Weary Trump Appears to Doze Off in Courtroom Ahead of Criminal Trial,Ok-Sweet-8495,1713201966.0,https://www.nytimes.com/2024/04/15/nyregion/trump-asleep-criminal-trial.html
1c4qi4v,"""Every time I buy more, the price drops more"": Trump supporters grapple with Truth Social losses Many invested in Truth Social to support former President Donald Trump, but steep losses are testing their faith",Arrest_The_President,1713198435.0,https://www.salon.com/2024/04/15/every-time-i-buy-more-the-price-drops-more-supporters-grapple-with-truth-social-losses/?in_brief=true
1c4hrwt,Donald Trump is falling behind Joe Biden in battleground state campaigning,BelleAriel,1713172626.0,https://www.newsweek.com/donald-trump-falling-behind-joe-biden-battleground-state-campaigning-1889429
